{
    "$schema": "http://json-schema.org/draft-04/schema#",
    "type": "array",
    "items": {
        "type": "object",
        "properties": {
            "unique_id": {
                "type": "string"
            },
            "name": {
                "type": "string"
            },
            "description": {
                "type": "string"
            },
            "description_plain": {
                "type": "string"
            }
        },
        "required": [
            "unique_id",
            "name",
            "description",
            "description_plain"
        ]
    }
}