[
    {
        "unique_id": "77JKJwz6k8BRrGbmRDPTT",
        "name": "Blocage Arcane X",
        "description": "",
        "description_plain": ""
    },
    {
        "unique_id": "tHNMT9DMtgRNTBrnCjdWq",
        "name": "Attaque",
        "description": "",
        "description_plain": ""
    },
    {
        "unique_id": "bKgtwKPTzJ69QdFDfm9bR",
        "name": "Usure de Guerre",
        "description": "",
        "description_plain": ""
    },
    {
        "unique_id": "cG88qzrJhwLnJH6TJ9cpp",
        "name": "Lame Brisée",
        "description": "",
        "description_plain": ""
    },
    {
        "unique_id": "wPWTbtBBwWkLhTz7hMrn7",
        "name": "Boostez",
        "description": "",
        "description_plain": ""
    },
    {
        "unique_id": "H6nNm6Nndrp8qTGFJL7GB",
        "name": "Combo",
        "description": "",
        "description_plain": ""
    },
    {
        "unique_id": "rG7F9GkDcmwNMczRbtwhL",
        "name": "Écrasement",
        "description": "",
        "description_plain": ""
    },
    {
        "unique_id": "LdpzkhTrrcHJJtLFnctGW",
        "name": "Dominer",
        "description": "",
        "description_plain": ""
    },
    {
        "unique_id": "mmf6BdTtrbCGrhdhg8K9g",
        "name": "Go again",
        "description": "",
        "description_plain": ""
    },
    {
        "unique_id": "NdTgddPBhJLhG7HRjqPG6",
        "name": "Intimidez",
        "description": "",
        "description_plain": ""
    },
    {
        "unique_id": "TrD8trBHtDqmdKtd9jMWr",
        "name": "Légendaire",
        "description": "",
        "description_plain": ""
    },
    {
        "unique_id": "bfRPRwTzzCPNRmNbfhdq7",
        "name": "Optez X",
        "description": "",
        "description_plain": ""
    },
    {
        "unique_id": "CMkCBFwkdRTkckLfBwhjL",
        "name": "Rechargez",
        "description": "",
        "description_plain": ""
    },
    {
        "unique_id": "BN9pfqWtQjNgCHFrgmNHJ",
        "name": "Reprise",
        "description": "",
        "description_plain": ""
    },
    {
        "unique_id": "cjn8CBRWPmdG8fwJNTBJt",
        "name": "Spécialisation",
        "description": "",
        "description_plain": ""
    },
    {
        "unique_id": "RnrzPrG6KfnCPhDCF8bpB",
        "name": "Temper",
        "description": "",
        "description_plain": ""
    }
]