[
    {
        "unique_id": "77JKJwz6k8BRrGbmRDPTT",
        "name": "Arkane Barriere X",
        "description": "",
        "description_plain": ""
    },
    {
        "unique_id": "tHNMT9DMtgRNTBrnCjdWq",
        "name": "Attacke",
        "description": "",
        "description_plain": ""
    },
    {
        "unique_id": "bKgtwKPTzJ69QdFDfm9bR",
        "name": "Von der Schlacht gezeichnet",
        "description": "",
        "description_plain": ""
    },
    {
        "unique_id": "cG88qzrJhwLnJH6TJ9cpp",
        "name": "Klingenbruch",
        "description": "",
        "description_plain": ""
    },
    {
        "unique_id": "wPWTbtBBwWkLhTz7hMrn7",
        "name": "Boost",
        "description": "",
        "description_plain": ""
    },
    {
        "unique_id": "H6nNm6Nndrp8qTGFJL7GB",
        "name": "Kombo",
        "description": "",
        "description_plain": ""
    },
    {
        "unique_id": "rG7F9GkDcmwNMczRbtwhL",
        "name": "Zerschmetterung",
        "description": "",
        "description_plain": ""
    },
    {
        "unique_id": "LdpzkhTrrcHJJtLFnctGW",
        "name": "Dominieren",
        "description": "",
        "description_plain": ""
    },
    {
        "unique_id": "mmf6BdTtrbCGrhdhg8K9g",
        "name": "Go again",
        "description": "",
        "description_plain": ""
    },
    {
        "unique_id": "NdTgddPBhJLhG7HRjqPG6",
        "name": "Einschüchtern",
        "description": "",
        "description_plain": ""
    },
    {
        "unique_id": "TrD8trBHtDqmdKtd9jMWr",
        "name": "Legendär",
        "description": "",
        "description_plain": ""
    },
    {
        "unique_id": "bfRPRwTzzCPNRmNbfhdq7",
        "name": "Sortiere X Um",
        "description": "",
        "description_plain": ""
    },
    {
        "unique_id": "CMkCBFwkdRTkckLfBwhjL",
        "name": "Nachladen",
        "description": "",
        "description_plain": ""
    },
    {
        "unique_id": "BN9pfqWtQjNgCHFrgmNHJ",
        "name": "Fortführen",
        "description": "",
        "description_plain": ""
    },
    {
        "unique_id": "cjn8CBRWPmdG8fwJNTBJt",
        "name": "Spezialisierung",
        "description": "",
        "description_plain": ""
    },
    {
        "unique_id": "RnrzPrG6KfnCPhDCF8bpB",
        "name": "Tempern",
        "description": "",
        "description_plain": ""
    }
]