[
    {
        "unique_id": "77JKJwz6k8BRrGbmRDPTT",
        "name": "Barrera arcana 2",
        "description": "",
        "description_plain": ""
    },
    {
        "unique_id": "tHNMT9DMtgRNTBrnCjdWq",
        "name": "Atacar",
        "description": "",
        "description_plain": ""
    },
    {
        "unique_id": "bKgtwKPTzJ69QdFDfm9bR",
        "name": "Desgaste de batalla",
        "description": "",
        "description_plain": ""
    },
    {
        "unique_id": "cG88qzrJhwLnJH6TJ9cpp",
        "name": "Rotura de espada",
        "description": "",
        "description_plain": ""
    },
    {
        "unique_id": "wPWTbtBBwWkLhTz7hMrn7",
        "name": "Potenciar",
        "description": "",
        "description_plain": ""
    },
    {
        "unique_id": "H6nNm6Nndrp8qTGFJL7GB",
        "name": "Combo",
        "description": "",
        "description_plain": ""
    },
    {
        "unique_id": "rG7F9GkDcmwNMczRbtwhL",
        "name": "Aplastar",
        "description": "",
        "description_plain": ""
    },
    {
        "unique_id": "LdpzkhTrrcHJJtLFnctGW",
        "name": "Dominar",
        "description": "",
        "description_plain": ""
    },
    {
        "unique_id": "mmf6BdTtrbCGrhdhg8K9g",
        "name": "Continuar",
        "description": "",
        "description_plain": ""
    },
    {
        "unique_id": "NdTgddPBhJLhG7HRjqPG6",
        "name": "Intimidar",
        "description": "",
        "description_plain": ""
    },
    {
        "unique_id": "TrD8trBHtDqmdKtd9jMWr",
        "name": "Legendario",
        "description": "",
        "description_plain": ""
    },
    {
        "unique_id": "bfRPRwTzzCPNRmNbfhdq7",
        "name": "Opta X",
        "description": "",
        "description_plain": ""
    },
    {
        "unique_id": "CMkCBFwkdRTkckLfBwhjL",
        "name": "Recargar",
        "description": "",
        "description_plain": ""
    },
    {
        "unique_id": "BN9pfqWtQjNgCHFrgmNHJ",
        "name": "Vuelta",
        "description": "",
        "description_plain": ""
    },
    {
        "unique_id": "cjn8CBRWPmdG8fwJNTBJt",
        "name": "Especialización",
        "description": "",
        "description_plain": ""
    },
    {
        "unique_id": "RnrzPrG6KfnCPhDCF8bpB",
        "name": "Carácter",
        "description": "",
        "description_plain": ""
    }
]